,author,title,description,url,urlToImage,publishedAt,content,source.id,source.name
0,Reuters,Instacart names former Facebook global ads chief as president - Reuters,"Instacart on Wednesday named Facebook Inc <a href=""https://www.reuters.com/companies/FB.O"" target=""_blank"">(FB.O)</a> veteran Carolyn Everson as president and said she would lead its retail and advertising businesses, as the grocery delivery company hires mor…",https://www.reuters.com/business/retail-consumer/instacart-names-former-facebook-global-ads-chief-president-2021-08-04/,https://www.reuters.com/resizer/orKM4grRcuQslCbiOqbz-s_HBzM=/1200x628/smart/filters:quality(80)/cloudfront-us-east-2.images.arcpublishing.com/reuters/PA5VLEKNBFLHBODC73C4JCDV44.jpg,2021-08-04T15:32:00Z,"Facebook's Global Marketing Solutions Vice President Carolyn Everson gestures during a panel discussion at the annual Consumer Electronics Show (CES) in Las Vegas, Nevada January 8, 2014. REUTERS/Rob… [+1567 chars]",reuters,Reuters
1,Reuters Staff,Instacart names former Facebook global ads chief as president - Reuters,"Instacart on Wednesday named Facebook Inc veteran Carolyn Everson as president and said she would lead its retail and advertising businesses, as the grocery delivery company hires more fresh leadership ahead of an expected public listing.",https://www.reuters.com/article/instacart-moves-everson-idUSL4N2PA3ZD,https://s1.reutersmedia.net/resources_v2/images/rcom-default.png?w=800,2021-08-04T15:02:00Z,"By Reuters Staff
Aug 4 (Reuters) - Instacart on Wednesday named Facebook Inc veteran Carolyn Everson as president and said she would lead its retail and advertising businesses, as the grocery delive… [+1268 chars]",reuters,Reuters
2,Reuters,U.S. lawmaker says Facebook move to cut off researcher access is 'deeply concerning' - Reuters,"Senator Mark Warner said on Wednesday that Facebook Inc's <a href=""https://www.reuters.com/companies/FB.O"" target=""_blank"">(FB.O)</a> move to disable the accounts of a group of New York University researchers who were studying political ads on its platform wa…",https://www.reuters.com/technology/us-lawmaker-says-facebook-move-cut-off-researcher-access-is-deeply-concerning-2021-08-04/,https://www.reuters.com/resizer/fR44toA2IKrZ-jjj4Ec1L94wbiU=/1200x628/smart/filters:quality(80)/cloudfront-us-east-2.images.arcpublishing.com/reuters/XIJ5ZV4OL5N7FKBIZZA2AFDORY.jpg,2021-08-04T16:47:00Z,"Facebook app is seen on a smartphone in this illustration taken, July 13, 2021. REUTERS/Dado Ruvic/Illustration/File PhotoWASHINGTON, Aug 4 (Reuters) - Senator Mark Warner said on Wednesday that Face… [+2168 chars]",reuters,Reuters
3,Reuters Fact Check,Fact Check-Video does not show U.S. police planting evidence - Reuters,"A viral video filmed in the United States appears to show police planting evidence of drug dealing in a car, but bodycam recordings provided by the police show this was not the case.",https://www.reuters.com/article/factcheck-video-evidence-idUSL1N2PB0LH,https://s1.reutersmedia.net/resources_v2/images/rcom-default.png?w=800,2021-08-04T08:48:00Z,"A viral video filmed in the United States appears to show police planting evidence of drug dealing in a car, but bodycam recordings provided by the police show this was not the case.
The clip, filme… [+2333 chars]",reuters,Reuters
4,Jan Wolfe,Lawyers sanctioned over 'fantastical' suit alleging 2020 U.S. election was stolen - Reuters,"A U.S. judge on Wednesday sanctioned two lawyers who brought a lawsuit alleging the 2020 presidential election was stolen from Donald Trump and his supporters, calling their case ""one enormous conspiracy theory.""",https://www.reuters.com/world/us/lawyers-sanctioned-over-fantastical-suit-alleging-2020-us-election-was-stolen-2021-08-04/,https://www.reuters.com/resizer/uOWjS1xCQxBk8udNMhD1dX9Gvbw=/1200x628/smart/filters:quality(80)/cloudfront-us-east-2.images.arcpublishing.com/reuters/ZQ2ZTRAZ2BKYJG4MWWQBJ3LGXI.jpg,2021-08-04T16:23:00Z,"A privacy booth is seen as poll workers wait for voters at a voting site in Tripp Commons inside the Memorial Union building on the University of Wisconsin-Madison campus on Election Day in Madison, … [+2095 chars]",reuters,Reuters
5,Jan Wolfe,Lawyers sanctioned over 'fantastical' suit alleging 2020 U.S. election was stolen - Reuters,"A U.S. judge on Wednesday sanctioned two lawyers who brought a lawsuit alleging the 2020 presidential election was stolen from Donald Trump and his supporters, calling their case ""one enormous conspiracy theory.""",https://www.reuters.com/article/legal-us-usa-trump-lawyers-idUSKBN2F51ZZ,https://static.reuters.com/resources/r/?m=02&d=20210804&t=2&i=1570974430&r=LYNXMPEH7313N&w=800,2021-08-04T16:24:00Z,"(Reuters) - A U.S. judge on Wednesday sanctioned two lawyers who brought a lawsuit alleging the 2020 presidential election was stolen from Donald Trump and his supporters, calling their case one enor… [+1987 chars]",reuters,Reuters
6,Reuters,Karate-Russian Chernysheva out of Games after positive COVID-19 test - Reuters,"Russian karate athlete Anna Chernysheva has tested positive for COVID-19 and is out of the Tokyo Olympics, Russia's Karate Federation said.",https://www.reuters.com/lifestyle/sports/karate-russian-chernysheva-out-games-after-positive-covid-19-test-2021-08-04/,https://www.reuters.com/pf/resources/images/reuters/reuters-default.png?d=48,2021-08-04T08:04:00Z,"MOSCOW, Aug 4 (Reuters) - Russian karate athlete Anna Chernysheva has tested positive for COVID-19 and is out of the Tokyo Olympics, Russia's Karate Federation said.
""Very sad news from Japan - our … [+868 chars]",reuters,Reuters
7,Echo Wang,"US STOCKS-Wall Street closes mixed, S&P 500 ends off record high - Reuters","* Indexes: Dow off 0.92%, S&P down 0.46%, Nasdaq up 0.13% (Updates prices, adds volume, adds bullets)",https://www.reuters.com/article/usa-stocks-idUSL1N2PB2SJ,https://s1.reutersmedia.net/resources_v2/images/rcom-default.png?w=800,2021-08-04T20:59:00Z,"(For a Reuters live blog on U.S., UK and European stock markets, click LIVE/ or type LIVE/ in a news window.)
* GM slides despite posting quarterly profit
* Private payrolls growth slows as labor s… [+3503 chars]",reuters,Reuters
8,Echo Wang,US STOCKS-S&P 500 slips from record high as job growth slows - Reuters,"* Indexes: Dow off 0.81%, S&P down 0.31%, Nasdaq up 0.16% (Adds comments; updates prices)",https://www.reuters.com/article/usa-stocks-idUSL4N2PB3YZ,https://s1.reutersmedia.net/resources_v2/images/rcom-default.png?w=800,2021-08-04T18:13:00Z,"(For a Reuters live blog on U.S., UK and European stock markets, click LIVE/ or type LIVE/ in a news window.)
* GM slides despite posting quarterly profit
* Private payrolls growth slows as labor s… [+3244 chars]",reuters,Reuters
9,Reuters,Sweden to widen police data-access powers to fight gang violence - Reuters,"Sweden plans to give police greater powers to access data from mobile phones as it bids to rein in a surge in gang-related violence plaguing its major cities, the government said on Wednesday.",https://www.reuters.com/world/europe/sweden-widen-police-data-access-powers-fight-gang-violence-2021-08-04/,https://www.reuters.com/resizer/WcPVJRdXR5ORYaYLQr_JXJpCj14=/1200x628/smart/filters:quality(80)/cloudfront-us-east-2.images.arcpublishing.com/reuters/RTSS7KYW6NNCTPM653JQKPRWXY.jpg,2021-08-04T10:58:00Z,"Police officers work at the scene after a shooting in Kristianstad, Sweden August 3, 2021. Johan Nilsson/ TT News Agency/via REUTERS STOCKHOLM, Aug 4 (Reuters) - Sweden plans to give police greater p… [+1816 chars]",reuters,Reuters
10,Tatiana Bautzer,Brazil retailers hunt for M&A deals to compete for e-commerce dominance - Reuters,"In March last year, Oziel da Silva Santos needed a new TV but with stores closed due to COVID-19 restrictions in Brazil's northern city of Belem, the 50-year old was clueless about how to get one. He followed a link on the website of furniture retailer Via Va…",https://www.reuters.com/technology/brazil-retailers-hunt-ma-deals-compete-e-commerce-dominance-2021-08-04/,https://www.reuters.com/pf/resources/images/reuters/reuters-default.png?d=48,2021-08-04T10:06:00Z,"August 4 (Reuters) - In March last year, Oziel da Silva Santos needed a new TV but with stores closed due to COVID-19 restrictions in Brazil's northern city of Belem, the 50-year old was clueless abo… [+4685 chars]",reuters,Reuters
11,Sagarika Jaisinghani,Futures tread water after S&P 500 hits record high - Reuters,"U.S. stock index futures were muted on Wednesday following a record close for the S&P 500, while focus turned to data on the services sector for cues on whether a domestic economic rebound was stalling.",https://www.reuters.com/business/futures-tread-water-after-sp-500-hits-record-high-2021-08-04/,https://www.reuters.com/resizer/Ki_PixeG2ZPK5qLGx-RU4RFbagU=/1200x628/smart/filters:quality(80)/cloudfront-us-east-2.images.arcpublishing.com/reuters/CRF3LEYE6BMN7HORN5AHO4AN4Y.jpg,2021-08-04T11:33:00Z,"A Wall Street sign is pictured outside the New York Stock Exchange in New York, October 28, 2013. REUTERS/Carlo AllegriAug 4 (Reuters) - U.S. stock index futures were muted on Wednesday following a r… [+2123 chars]",reuters,Reuters
12,Echo Wang,S&P 500 slips from record high as job growth slows - Reuters,"The S&P 500 slipped from a record high on Wednesday as data signaled a sharp slowdown in jobs growth last month, while General Motors tracked its worst day in more than a year despite a record pre-tax profit.",https://www.reuters.com/business/sp-500-slips-record-high-job-growth-slows-2021-08-04/,https://www.reuters.com/resizer/Ki_PixeG2ZPK5qLGx-RU4RFbagU=/1200x628/smart/filters:quality(80)/cloudfront-us-east-2.images.arcpublishing.com/reuters/CRF3LEYE6BMN7HORN5AHO4AN4Y.jpg,2021-08-04T18:37:00Z,"A Wall Street sign is pictured outside the New York Stock Exchange in New York, October 28, 2013. REUTERS/Carlo AllegriAug 4 (Reuters) - The S&amp;P 500 slipped from a record high on Wednesday as dat… [+3258 chars]",reuters,Reuters
13,Echo Wang,"Wall Street closes mixed, S&P 500 ends off record high - Reuters","U.S. stocks closed mostly lower on Wednesday, with the S&P 500 falling from a record high after data signaled a slowdown in jobs growth in July, and General Motors tracked its worst day since early March.",https://www.reuters.com/business/wall-street-closes-mixed-sp-500-ends-off-record-high-2021-08-04/,https://www.reuters.com/resizer/Ki_PixeG2ZPK5qLGx-RU4RFbagU=/1200x628/smart/filters:quality(80)/cloudfront-us-east-2.images.arcpublishing.com/reuters/CRF3LEYE6BMN7HORN5AHO4AN4Y.jpg,2021-08-04T21:01:00Z,"Aug 4 (Reuters) - U.S. stocks closed mostly lower on Wednesday, with the S&amp;P 500 falling from a record high after data signaled a slowdown in jobs growth in July, and General Motors tracked its w… [+3514 chars]",reuters,Reuters
14,Reuters Staff,"Factbox: Major U.S. companies making masks, vaccines mandatory - Reuters.com",The resurgence of COVID-19 cases in the United States due to the Delta variant and the new guidance from the U.S. Centers for Disease Control and Prevention (CDC) that requires fully vaccinated individuals to wear masks have led companies to change their plan…,https://www.reuters.com/article/us-health-coronavirus-companies-idUSKBN2F52IB,https://static.reuters.com/resources/r/?m=02&d=20210804&t=2&i=1571000928&r=LYNXMPEH731DT&w=800,2021-08-04T21:33:00Z,"By Reuters Staff
(Reuters) - The resurgence of COVID-19 cases in the United States due to the Delta variant and the new guidance from the U.S. Centers for Disease Control and Prevention (CDC) that r… [+3379 chars]",reuters,Reuters
15,Echo Wang,Wall Street ends mixed with S&P 500 off record high - Reuters,"Wall Street's main indexes closed mostly lower on Wednesday, with the S&P 500 falling from a record high hit a day earlier as data signaled a sharp slowdown in jobs growth in July, while General Motors tracked its worst day in more than a year despite a recor…",https://www.reuters.com/business/wall-street-ends-mixed-with-sp-500-off-record-high-2021-08-04/,https://www.reuters.com/resizer/Ki_PixeG2ZPK5qLGx-RU4RFbagU=/1200x628/smart/filters:quality(80)/cloudfront-us-east-2.images.arcpublishing.com/reuters/CRF3LEYE6BMN7HORN5AHO4AN4Y.jpg,2021-08-04T20:13:00Z,"Aug 4 (Reuters) - Wall Street's main indexes closed mostly lower on Wednesday, with the S&amp;P 500 falling from a record high hit a day earlier as data signaled a sharp slowdown in jobs growth in Ju… [+3214 chars]",reuters,Reuters
16,Reuters Staff,Olympics-Karate-Russian Chernysheva out of Games after positive COVID-19 test,"Russian karate athlete Anna Chernysheva has tested positive for COVID-19 and is out of the Tokyo Olympics, Russia's Karate Federation said.",https://www.reuters.com/article/us-olympics-2020-kar-russia-idUSKBN2F50S8,https://s1.reutersmedia.net/resources_v2/images/rcom-default.png?w=800,2021-08-04T07:56:49Z,"By Reuters Staff
MOSCOW (Reuters) - Russian karate athlete Anna Chernysheva has tested positive for COVID-19 and is out of the Tokyo Olympics, Russias Karate Federation said.
Very sad news from Jap… [+733 chars]",reuters,Reuters
