,author,title,description,url,urlToImage,publishedAt,content,source.id,source.name
0,Reuters,"Facebook, Amazon seek U.S. approval to operate undersea data cable - Reuters","Facebook Inc <a href=""https://www.reuters.com/companies/FB.O"" target=""_blank"">(FB.O)</a> and Amazon.com Inc <a href=""https://www.reuters.com/companies/AMZN.O"" target=""_blank"">(AMZN.O)</a> have asked the U.S. government for approval to operate a new undersea d…",https://www.reuters.com/technology/facebook-amazon-seek-us-approval-operate-undersea-data-cable-2021-08-13/,https://www.reuters.com/resizer/XCpkxfaB7gI_nCBzZxaOeMVFymc=/1200x628/smart/filters:quality(80)/cloudfront-us-east-2.images.arcpublishing.com/reuters/2OGXZ653EROXRGMYI5WJSG4IAE.jpg,2021-08-13T16:51:00Z,"WASHINGTON, Aug 13 (Reuters) - Facebook Inc (FB.O) and Amazon.com Inc (AMZN.O) have asked the U.S. government for approval to operate a new undersea data cable between the Philippines and California … [+661 chars]",reuters,Reuters
1,Reuters,Tunisian president receives U.S. delegation carrying message from Biden - Reuters,"Tunisian President Kais Saied on Friday received an official U.S. delegation headed by deputy national security adviser Jonathan Finer, who carried a written message from President Joe Biden, the Tunisian presidency posted on Facebook.",https://www.reuters.com/world/africa/tunisian-president-receives-us-delegation-carrying-message-biden-2021-08-13/,https://www.reuters.com/resizer/UrDTzhM2Jtx94wfNlyXHE2JylZY=/800x419/smart/filters:quality(80)/cloudfront-us-east-2.images.arcpublishing.com/reuters/KUAXNCUGRJLHZK23BYIQLKPBNU.jpg,2021-08-13T20:00:00Z,"Tunisian President Kais Saied takes the oath of office in Tunis, Tunisia, October 23, 2019. REUTERS/Zoubeir SouissiCAIRO, Aug 13 (Reuters) - Tunisian President Kais Saied on Friday received an offici… [+613 chars]",reuters,Reuters
2,Reuters,"Chevron delays office return in California, Texas due to Delta spread - Bloomberg News - Reuters","Oil major Chevron Corp <a href=""https://www.reuters.com/companies/CVX.N"" target=""_blank"">(CVX.N)</a> is postponing the full return of employees in California and Texas, joining a clutch of companies like Facebook Inc <a href=""https://www.reuters.com/companies…",https://www.reuters.com/business/chevron-delays-office-return-california-texas-due-delta-spread-bloomberg-news-2021-08-13/,https://www.reuters.com/resizer/dpY6VEIwopOaON6yLbHqytMZNE0=/1200x628/smart/filters:quality(80)/cloudfront-us-east-2.images.arcpublishing.com/reuters/4SLSS5YX7BNTTPVGUHHQ66JXIM.jpg,2021-08-13T22:03:00Z,"The logo of Chevron is shown on a monitor above the floor of the New York Stock Exchange in New York, December 30, 2015. REUTERS/Lucas Jackson/FilesAug 13 (Reuters) - Oil major Chevron Corp (CVX.N) i… [+887 chars]",reuters,Reuters
3,Chris Mfula,Zambia counts votes as internet restriction remain in force - Reuters,Zambia's election commission will on Friday start announcing results of a tight presidential vote between top contenders President Edgar Lungu and main rival Hakainde Hichilema that was marred by restrictions on the internet and violence in three regions.,https://www.reuters.com/world/africa/zambia-counts-votes-internet-restriction-remain-force-2021-08-13/,https://www.reuters.com/resizer/Rk8_rmeSYRdJc444L7cyuAxTxU0=/800x419/smart/filters:quality(80)/cloudfront-us-east-2.images.arcpublishing.com/reuters/LHBDZXLU7VP67AGWSCZORHJ5DY.jpg,2021-08-13T06:53:00Z,"LUSAKA, Aug 13 (Reuters) - Zambia's election commission will on Friday start announcing results of a tight presidential vote between top contenders President Edgar Lungu and main rival Hakainde Hichi… [+2029 chars]",reuters,Reuters
4,Reuters,U.S. military base in Washington on lockdown due to potential armed individual - Reuters,"A military base in Washington, D.C., said it was on lockdown on Friday because there was a potentially armed person it described as a Black man with a medium build carrying a Gucci bag on the base.",https://www.reuters.com/world/us/us-military-base-washington-lockdown-due-potential-armed-individual-2021-08-13/,https://www.reuters.com/pf/resources/images/reuters/reuters-default.png?d=49,2021-08-13T17:18:00Z,"WASHINGTON, Aug 13 (Reuters) - A military base in Washington, D.C., said it was on lockdown on Friday because there was a potentially armed person it described as a Black man with a medium build carr… [+320 chars]",reuters,Reuters
5,Mike Scarcella,"Week Ahead in Antitrust: Aug. 16, 2021 - Reuters","Here are a few upcoming events of interest to the antitrust community. Unless otherwise noted, all times are local, and court appearances are virtual due to the COVID-19 pandemic.",https://www.reuters.com/legal/litigation/week-ahead-antitrust-aug-16-2021-2021-08-13/,https://www.reuters.com/resizer/VVkux1Z24j6vfk_2fnqwfTwmFsI=/1200x628/smart/filters:quality(80)/cloudfront-us-east-2.images.arcpublishing.com/reuters/RKB33LUMCFPMJKF32PCOCU7EHY.jpg,2021-08-13T18:11:00Z,"<ul><li>
</li><li>
</li><li>
Skadden, Arps, Slate, Meagher &amp; Flom LLP and Affiliates
</li><li>
</li><li>
Lewis Brisbois Bisgaard &amp; Smith LLP
</li></ul>
The company and law firm names … [+4686 chars]",reuters,Reuters
6,Reuters,Ukrainian Olympic gold medallist says he was racially abused in the street - Reuters,A Ukrainian wrestler who won his country's only gold medal at the Tokyo Olympics last week said he was racially abused in the street on Friday on his return from the games.,https://www.reuters.com/lifestyle/sports/ukrainian-olympic-gold-medallist-says-he-was-racially-abused-street-2021-08-13/,https://www.reuters.com/resizer/aFLUNhsKXGdssqXEI67-sGaV698=/1200x628/smart/filters:quality(80)/cloudfront-us-east-2.images.arcpublishing.com/reuters/WRGL47ELY5OAFII7NEQ34VAOZY.jpg,2021-08-13T16:01:00Z,"Tokyo 2020 Olympics - Wrestling - Greco-Roman - Men's 87kg - Medal Ceremony - Makuhari Messe Hall A, Chiba, Japan - August 4, 2021. Gold medalist Zhan Beleniuk of Ukraine walks with silver medalist V… [+2312 chars]",reuters,Reuters
7,Reuters Staff,U.S. House members introduce bill targeting Apple and Google app stores - Reuters,A Republican and a Democratic member of the U.S. House of Representatives introduced a bill aimed at reining in powerful app stores run by companies like Apple Inc and Alphabet Inc's Google.,https://www.reuters.com/article/tech-antitrust-congress-idUSL1N2PK00A,https://s1.reutersmedia.net/resources_v2/images/rcom-default.png?w=800,2021-08-13T09:00:00Z,"By Reuters Staff
WASHINGTON, Aug 13 (Reuters) - A Republican and a Democratic member of the U.S. House of Representatives introduced a bill aimed at reining in powerful app stores run by companies l… [+1365 chars]",reuters,Reuters
8,Reuters,IBM to allow only fully vaccinated to return to U.S. offices from Sept. 7 - Reuters,"International Business Machines Corp <a href=""https://www.reuters.com/companies/IBM.N"" target=""_blank"">(IBM.N)</a> said on Friday that it would allow only fully vaccinated U.S. employees to return to offices, which are set to open from Sept. 7, given the rapi…",https://www.reuters.com/world/us/ibm-allow-only-fully-vaccinated-return-us-offices-sept-7-2021-08-13/,https://www.reuters.com/resizer/n6RlH2qOYcWiKx7M6SLPEYsUdTA=/1200x628/smart/filters:quality(80)/cloudfront-us-east-2.images.arcpublishing.com/reuters/46GYAD5VQJJB3DOCQJUYRVNYWA.jpg,2021-08-13T22:35:00Z,"A man stands near an IBM logo at the Mobile World Congress in Barcelona, Spain, February 25, 2019. REUTERS/Sergio PerezAug 13 (Reuters) - International Business Machines Corp (IBM.N) said on Friday t… [+1285 chars]",reuters,Reuters
9,Reuters,U.S. discusses urgent need for Tunisia prime minister-designate -White House - Reuters,"The U.S. deputy national security adviser met Tunisia's president on Friday and discussed the urgent need to appoint a prime minister designate to form a capable government, the White House said.",https://www.reuters.com/world/africa/us-discusses-urgent-need-tunisia-prime-minister-designate-white-house-2021-08-13/,https://www.reuters.com/resizer/OB8DyC1CHkP1gvefDw48LHYH6FE=/1200x628/smart/filters:quality(80)/cloudfront-us-east-2.images.arcpublishing.com/reuters/BQTYHS6ZFBN57EEJFWTYHKHWZ4.jpg,2021-08-13T21:42:00Z,"Tunisian President Kais Saied addresses the nation in this screengrab taken from Tunisian President's office footage, Tunisia July 25, 2021. TUNISIAN PRESIDENT'S OFFICE/via REUTERS TVWASHINGTON, Aug … [+1880 chars]",reuters,Reuters
10,Reuters,U.S. House members introduce bill targeting Apple and Google app stores - Reuters,"A Republican and a Democratic member of the U.S. House of Representatives introduced a bill aimed at reining in powerful app stores run by companies like Apple Inc <a href=""https://www.reuters.com/companies/AAPL.O"" target=""_blank"">(AAPL.O)</a> and Alphabet In…",https://www.reuters.com/technology/us-house-members-introduce-bill-targeting-apple-google-app-stores-2021-08-13/,https://www.reuters.com/resizer/2dDpl5adWZaAwQ75_OsxsAfIA4o=/1200x628/smart/filters:quality(80)/cloudfront-us-east-2.images.arcpublishing.com/reuters/ZVN5RVQQTNMYLLTF2S2VC45HMU.jpg,2021-08-13T09:25:00Z,"The Apple Inc logo is seen at the entrance to the Apple store in Brussels, Belgium July 2, 2021. REUTERS/Yves HermanWASHINGTON, Aug 13 (Reuters) - A Republican and a Democratic member of the U.S. Hou… [+1579 chars]",reuters,Reuters
11,Reuters Fact Check,Fact Check-Marine Corps General did not ‘rebuke’ Defense Secretary over COVID-19 vaccine mandate - Reuters,Posts circulating on social media that claim that Commandant of the U.S. Marine Corps General David Berger ‘rebuked’ U.S. Secretary of Defense Lloyd James Austin III are false. The source of the claim is a website that has shared multiple false stories in the…,https://www.reuters.com/article/factcheck-marine-corps-hoax-idUSL1N2PK26O,https://s1.reutersmedia.net/resources_v2/images/rcom-default.png?w=800,2021-08-13T20:46:00Z,Posts circulating on social media that claim that Commandant of the U.S. Marine Corps General David Berger rebuked U.S. Secretary of Defense Lloyd James Austin III are false. The source of the claim … [+1792 chars],reuters,Reuters
12,Jiraporn Kuhakan,"Thai volunteers provide lifeline to elderly, sick cut off by pandemic - Reuters","Decked out in personal protective equipment, former pilot Chayaphon Satondee dashes to the Bangkok home of an elderly coronavirus patient in urgent need of hospital care.",https://www.reuters.com/world/asia-pacific/thai-volunteers-provide-lifeline-elderly-sick-cut-off-by-pandemic-2021-08-13/,https://www.reuters.com/resizer/b4swn7jDVe6wxQRQEj1x_HT6gkU=/1200x628/smart/filters:quality(80)/cloudfront-us-east-2.images.arcpublishing.com/reuters/Z2OYVGVMCFKJ7DBFWJLKCDFK4Y.jpg,2021-08-13T01:08:00Z,"BANGKOK, Aug 13 (Reuters) - Decked out in personal protective equipment, former pilot Chayaphon Satondee dashes to the Bangkok home of an elderly coronavirus patient in urgent need of hospital care.… [+2289 chars]",reuters,Reuters
13,Jiraporn Kuhakan,"Thai volunteers provide lifeline to elderly, sick cut off by pandemic - Reuters","Decked out in personal protective equipment, former pilot Chayaphon Satondee dashes to the Bangkok home of an elderly coronavirus patient in urgent need of hospital care.",https://www.reuters.com/article/health-coronavirus-thailand-volunteers-idUSL4N2PJ28X,https://s1.reutersmedia.net/resources_v2/images/rcom-default.png?w=800,2021-08-13T01:00:00Z,"BANGKOK, Aug 13 (Reuters) - Decked out in personal protective equipment, former pilot Chayaphon Satondee dashes to the Bangkok home of an elderly coronavirus patient in urgent need of hospital care.… [+2218 chars]",reuters,Reuters
14,Mike Scarcella,"New disclosures show DOJ officials' law firm compensation, clients - Reuters","A former Jones Day partner in Washington, D.C., who returned earlier this year to the U.S. Justice Department to serve as senior counselor to Deputy Attorney General Lisa Monaco reported earning more than $2.8 million in partner compensation on a newly releas…",https://www.reuters.com/legal/legalindustry/new-disclosures-show-doj-officials-law-firm-compensation-clients-2021-08-13/,https://www.reuters.com/resizer/wqO_Ha9lgZSuxO1MjlRknv4m8OQ=/1200x628/smart/filters:quality(80)/cloudfront-us-east-2.images.arcpublishing.com/reuters/64NJDARGZJPBPES3ALJFFZIGKM.jpg,2021-08-13T20:51:00Z,"A woman walks past the U.S. Department of Justice Building, in Washington, D.C. REUTERS/Al DragoThe company and law firm names shown above are generated automatically based on the text of the article… [+4064 chars]",reuters,Reuters
15,Reuters Staff,"Facebook, Amazon seek U.S. approval to operate undersea data cable","Facebook Inc and Amazon.com Inc have asked the U.S. government for approval to operate a new undersea data cable between the Philippines and California after China Mobile agreed to exit the plan, a government agency said Friday.",https://www.reuters.com/article/us-facebook-amazon-com-cable-idUSKBN2FE1P4,https://static.reuters.com/resources/r/?m=02&d=20210813&t=2&i=1571850424&r=LYNXMPEH7C0Y9&w=800,2021-08-13T16:51:37Z,"By Reuters Staff
WASHINGTON (Reuters) - Facebook Inc and Amazon.com Inc have asked the U.S. government for approval to operate a new undersea data cable between the Philippines and California after … [+529 chars]",reuters,Reuters
16,Reuters Staff,"Facebook rolls out end-to-end encryption for Messenger voice, video calls","Facebook Inc on Friday rolled out end-to-end encryption for voice and video calls on Messenger, adding another layer of privacy to its widely used communications platform.",https://www.reuters.com/article/us-facebook-encryption-idUSKBN2FE1OQ,https://static.reuters.com/resources/r/?m=02&d=20210813&t=2&i=1571850371&r=LYNXMPEH7C0Y2&w=800,2021-08-13T16:44:54Z,"By Reuters Staff
FILE PHOTO: A Facebook logo is displayed on a smartphone in this illustration taken January 6, 2020. REUTERS/Dado Ruvic/File Photo
(Reuters) - Facebook Inc on Friday rolled out end… [+815 chars]",reuters,Reuters
17,Reuters,"Facebook rolls out end-to-end encryption for Messenger voice, video calls","Facebook Inc <a href=""https://www.reuters.com/companies/FB.O"" target=""_blank"">(FB.O)</a> on Friday rolled out end-to-end encryption for voice and video calls on Messenger, adding another layer of privacy to its widely used communications platform.",https://www.reuters.com/technology/facebook-rolls-out-end-to-end-encryption-messenger-voice-video-calls-2021-08-13/,https://www.reuters.com/resizer/UGmf4xKXsw27_YKetZ54qfIX1yM=/1200x628/smart/filters:quality(80)/cloudfront-us-east-2.images.arcpublishing.com/reuters/5KY6BJKJQNL7PDQH7QQOPQ4YDU.jpg,2021-08-13T16:48:29Z,"A Facebook logo is displayed on a smartphone in this illustration taken January 6, 2020. REUTERS/Dado Ruvic/File PhotoAug 13 (Reuters) - Facebook Inc (FB.O) on Friday rolled out end-to-end encryption… [+928 chars]",reuters,Reuters
18,Reuters Staff,Tunisian president receives U.S. delegation carrying message from Biden,"Tunisian President Kais Saied on Friday received an official U.S. delegation headed by deputy national security adviser Jonathan Finer, who carried a written message from President Joe Biden, the Tunisian presidency posted on Facebook.",https://www.reuters.com/article/us-tunisia-politics-usa-idUSKBN2FE1X1,https://static.reuters.com/resources/r/?m=02&d=20210813&t=2&i=1571863313&r=LYNXMPEH7C12N&w=800,2021-08-13T20:00:15Z,"By Reuters Staff
FILE PHOTO: Tunisian President Kais Saied takes the oath of office in Tunis, Tunisia, October 23, 2019. REUTERS/Zoubeir Souissi
CAIRO (Reuters) - Tunisian President Kais Saied on F… [+528 chars]",reuters,Reuters
19,Reuters Staff,"Chevron delays office return in California, Texas due to Delta spread - Bloomberg News","Oil major Chevron Corp is postponing the full return of employees to its headquarters in San Ramon, California, and its largest office in Houston due to the rapid spread of the Delta variant of the coronavirus, Bloomberg News reported on Friday.",https://www.reuters.com/article/health-coronavirus-chevron-idUSL4N2PK3YQ,https://s1.reutersmedia.net/resources_v2/images/rcom-default.png?w=800,2021-08-13T21:54:22Z,"By Reuters Staff
Aug 13 (Reuters) - Oil major Chevron Corp is postponing the full return of employees to its headquarters in San Ramon, California, and its largest office in Houston due to the rapid… [+626 chars]",reuters,Reuters
0,Reuters Staff,U.S. discusses urgent need for Tunisia prime minister-designate -White House,"The U.S. deputy national security adviser met Tunisia's president on Friday and discussed the urgent need to appoint a prime minister designate to form a capable government, the White House said.",https://www.reuters.com/article/us-tunisia-politics-usa-finer-idUSKBN2FE21Q,https://static.reuters.com/resources/r/?m=02&d=20210813&t=2&i=1571869824&r=LYNXMPEH7C14U&w=800,2021-08-13T21:42:30Z,"By Reuters Staff
FILE PHOTO: Tunisian President Kais Saied addresses the nation in this screengrab taken from Tunisian President's office footage, Tunisia July 25, 2021. TUNISIAN PRESIDENT'S OFFICE/… [+1717 chars]",reuters,Reuters
1,Reuters Fact Check,Fact Check-2020 CDC document about COVID-19 measures for those in humanitarian settings misinterpreted online,An official COVID-19 shielding discussion has been misrepresented by social media users who claim it reveals the United States plans to put high-risk people from the general population into camps. The document in from 2020 and actually outlines a strategy for…,https://www.reuters.com/article/factcheck-cdc-document-idUSL1N2PK1OU,https://s1.reutersmedia.net/resources_v2/images/rcom-default.png?w=800,2021-08-13T18:53:34Z,"Adding CDC comment
An official COVID-19 shielding discussion has been misrepresented by social media users who claim it reveals the United States plans to put high-risk people from the general popul… [+3750 chars]",reuters,Reuters
